{
  "scenario_id": "government-cbs-share-2029",
  "competence_date": "2029-04-10",
  "knowledge_at": "2026-09-28T16:31:00-03:00",
  "rule_bundle_id": "CONSUMPTION-PHASE4B-2026.09.28-12",
  "catalog_versions": {
    "services": "2026.09.17-1",
    "municipal_parameters": "2026.09.16-1",
    "public_annex_i": "rfb-41766-sandbox-1",
    "federal_obligations": "2026-sandbox-3",
    "federal_banking_calendar": "2026-national-febraban-1",
    "rtc_rates": "2026.09.25-1",
    "rtc_codes": "2026.09.28-10",
    "rtc_transition": "2026.09.28-12"
  },
  "facts": {
    "service.canonical_id": "SOFTWARE_DEVELOPMENT",
    "provider.municipality_ibge": "3550308",
    "customer.municipality_ibge": "3509502",
    "customer.person_type": "PUBLIC_ADMINISTRATION",
    "operation.service_origin": "DOMESTIC",
    "provider.tax_regime": "LUCRO_REAL",
    "provider.person_type": "PRIVATE_LEGAL_ENTITY",
    "operation.amount": "1000.00",
    "federal.evaluate_withholdings": false,
    "rtc.evaluate": true,
    "rtc.operation_date": "2029-04-10",
    "rtc.operation_kind": "DIGITAL",
    "rtc.buyer_relation": "B2B",
    "rtc.delivery_mode": "DIGITAL",
    "rtc.consideration": "ONEROUS",
    "rtc.market": "DOMESTIC",
    "rtc.supplier_regime": "REGULAR",
    "rtc.supplier_id": "11111111000191",
    "rtc.supplier_country": "BR",
    "rtc.acquirer_id": "22222222000191",
    "rtc.recipient_id": "22222222000191",
    "rtc.acquirer_country": "BR",
    "rtc.recipient_country": "BR",
    "rtc.destination_basis": "ACQUIRER_DOMICILE",
    "rtc.destination_state": "SP",
    "rtc.destination_municipality_ibge": "3509502",
    "rtc.destination_evidence_id": "contract-establishment-1",
    "rtc.document_id": "dps-1",
    "rtc.gross_amount": "1000.00",
    "rtc.gross_currency": "BRL",
    "rtc.legacy_tax_inclusion": "EXCLUDED",
    "rtc.legacy_tax_evidence_id": "net-price-contract-line-1",
    "rtc.base_adjustments": [],
    "rtc.tax_treatment": "STANDARD",
    "rtc.collection_method": "SUPPLIER",
    "rtc.accessory_obligations_fulfilled": false,
    "rtc.credit_context": "OUTPUT",
    "rtc.government_entity_type": "DIRECT",
    "rtc.government_entity_evidence_id": "public-entity-register-1",
    "rtc.government_public_law_person": true,
    "rtc.government_in_person": false,
    "rtc.government_licitation_waived": false,
    "rtc.government_national_uniform_rate": false,
    "rtc.government_federation": "MUNICIPALITY",
    "rtc.government_payment_date": "2029-04-10",
    "rtc.government_payment_evidence_id": "payment-2"
  }
}
