{
  "scenario_id": "integrated-cooperative-network-transfer-transfer-overdrawn-2026",
  "competence_date": "2026-10-01",
  "knowledge_at": "2026-10-02T14:11:07+00:00",
  "rule_bundle_id": "CONSUMPTION-PHASE4B-2026.10.02-10",
  "catalog_versions": {
    "services": "2026.09.17-1",
    "municipal_parameters": "2026.10.01-5",
    "public_annex_i": "rfb-41766-sandbox-1",
    "federal_obligations": "2026-sandbox-3",
    "federal_banking_calendar": "2026-national-febraban-1",
    "rtc_rates": "2026.09.25-1",
    "rtc_codes": "2026.10.02-10",
    "rtc_transition": "2026.10.01-2"
  },
  "facts": {
    "service.canonical_id": "CTRIBNAC_080101",
    "provider.municipality_ibge": "3550308",
    "customer.municipality_ibge": "3509502",
    "customer.person_type": "PJ",
    "operation.service_origin": "DOMESTIC",
    "provider.tax_regime": "LUCRO_REAL",
    "provider.person_type": "PRIVATE_LEGAL_ENTITY",
    "operation.amount": "1000.00",
    "federal.evaluate_withholdings": false,
    "rtc.evaluate": true,
    "rtc.operation_date": "2026-10-01",
    "rtc.operation_kind": "SERVICE",
    "rtc.buyer_relation": "B2B",
    "rtc.delivery_mode": "PRESENTIAL",
    "rtc.consideration": "ONEROUS",
    "rtc.market": "DOMESTIC",
    "rtc.supplier_regime": "REGULAR",
    "rtc.supplier_id": "11111111000191",
    "rtc.supplier_country": "BR",
    "rtc.acquirer_id": "22222222000191",
    "rtc.recipient_id": "12345678901",
    "rtc.acquirer_country": "BR",
    "rtc.recipient_country": "BR",
    "rtc.destination_basis": "PERSON_PRESENCE",
    "rtc.destination_state": "SP",
    "rtc.destination_municipality_ibge": "3550308",
    "rtc.destination_evidence_id": "contract-establishment-1",
    "rtc.document_id": "dps-1",
    "rtc.gross_amount": "1000.00",
    "rtc.gross_currency": "BRL",
    "rtc.legacy_tax_inclusion": "EXCLUDED",
    "rtc.legacy_tax_evidence_id": "net-price-contract-line-1",
    "rtc.base_adjustments": [],
    "rtc.tax_treatment": "ZERO_RATE",
    "rtc.collection_method": "SUPPLIER",
    "rtc.accessory_obligations_fulfilled": true,
    "rtc.credit_context": "OUTPUT",
    "rtc.service_on_person_or_enjoyed_in_person": true,
    "rtc.service_presence_evidence_id": "FIXTURE.PERSONAL.PERFORMANCE",
    "rtc.performance_municipality_ibge": "3550308",
    "rtc.performance_state": "SP",
    "rtc.supplier_establishment_state": "SP",
    "rtc.presence_at_supplier_establishment": true,
    "rtc.annex_service_description_confirmed": true,
    "rtc.annex_service_only_consideration": true,
    "rtc.annex_service_scope_evidence_id": "FIXTURE.ANNEX.CONSIDERATION",
    "rtc.service_nbs_evidence_id": "FIXTURE.NBS.CLASSIFICATION",
    "rtc.treatment_evidence_id": "FIXTURE.COOPERATIVE.DOCUMENTED.OPTION",
    "service.ctribnac_code": "080101",
    "rtc.annex_service_category": "EDUCATION",
    "rtc.annex_service_item": "2",
    "rtc.service_nbs_code": "1.2201.20.00",
    "rtc.treatment_rule_id": "RTC.COOPERATIVE.ART271-1",
    "rtc.acquirer_regime": "REGULAR",
    "rtc.cooperative_zero_proof": [
      {
        "supplier_id": "11111111000191",
        "acquirer_id": "22222222000191",
        "document_id": "dps-1",
        "cooperative_id": "22222222000191",
        "member_id": "11111111000191",
        "route": "MEMBER_TO_COOPERATIVE",
        "service_category": "NON_FINANCIAL",
        "valid_from": "2026-01-01",
        "valid_to": "2026-12-31",
        "observed_on": "2026-09-30",
        "option_exercised_on": "2025-12-10",
        "option_at_start_of_operations": false,
        "option_registered_and_effective": true,
        "membership_or_participation_valid": true,
        "cooperative_registry_evidence_id": "FIXTURE.COOPERATIVE.COOPERATIVE_REGISTRY_EVIDENCE_ID",
        "option_registration_evidence_id": "FIXTURE.COOPERATIVE.OPTION_REGISTRATION_EVIDENCE_ID",
        "option_regulatory_validation_evidence_id": "FIXTURE.COOPERATIVE.OPTION_REGULATORY_VALIDATION_EVIDENCE_ID",
        "membership_evidence_id": "FIXTURE.COOPERATIVE.MEMBERSHIP_EVIDENCE_ID",
        "service_scope_evidence_id": "FIXTURE.COOPERATIVE.SERVICE_SCOPE_EVIDENCE_ID"
      }
    ],
    "rtc.assess_cooperative_credit_transfer": true,
    "rtc.cooperative_credit_transfer": [
      {
        "member_id": "11111111000191",
        "cooperative_id": "22222222000191",
        "supply_document_id": "dps-1",
        "currency": "BRL",
        "observed_on": "2026-10-01",
        "credit_pool_complete": true,
        "credits_qualified_and_net_of_annulments": true,
        "transfer_not_already_recorded": true,
        "credit_pool_evidence_id": "FIXTURE.COMPLETE.NET.CREDITS",
        "transfer_regulatory_validation_evidence_id": "FIXTURE.REGULATORY.TRANSFER",
        "credits": [
          {
            "id": "credit-IBS",
            "tax": "IBS",
            "owner_id": "11111111000191",
            "acquisition_document_id": "acquisition1",
            "supply_document_id": "dps-1",
            "appropriation_date": "2026-09-10",
            "credit_kind": "ORDINARY",
            "appropriation_evidence_id": "FIXTURE.APPROPRIATED",
            "production_link_evidence_id": "FIXTURE.INPUT.USED.IN.SUPPLY",
            "available_balance_evidence_id": "FIXTURE.RECONCILED.NET.BALANCE",
            "extinction_evidence_id": "FIXTURE.EXTINCT.INPUT",
            "used_to_produce_this_supply": true,
            "appropriated_amount": "100.00",
            "already_used_transferred_or_refunded": "10.00",
            "annulled_or_refund_reserved": "20.00",
            "requested_transfer_amount": "70.01"
          },
          {
            "id": "credit-CBS",
            "tax": "CBS",
            "owner_id": "11111111000191",
            "acquisition_document_id": "acquisition1",
            "supply_document_id": "dps-1",
            "appropriation_date": "2026-09-10",
            "credit_kind": "ORDINARY",
            "appropriation_evidence_id": "FIXTURE.APPROPRIATED",
            "production_link_evidence_id": "FIXTURE.INPUT.USED.IN.SUPPLY",
            "available_balance_evidence_id": "FIXTURE.RECONCILED.NET.BALANCE",
            "extinction_evidence_id": "FIXTURE.EXTINCT.INPUT",
            "used_to_produce_this_supply": true,
            "appropriated_amount": "900.00",
            "already_used_transferred_or_refunded": "100.00",
            "annulled_or_refund_reserved": "200.00",
            "requested_transfer_amount": "500.00"
          }
        ]
      }
    ]
  }
}
