{
  "scenario_id": "SYNTHETIC-EXPORT-ISS96-no-contexts",
  "competence_date": "2026-09-25",
  "knowledge_at": "2026-10-16T14:55:50.614333+00:00",
  "rule_bundle_id": "CONSUMPTION-PHASE4B-2026.10.16-96-draft1",
  "catalog_versions": {
    "services": "2026.09.17-1",
    "municipal_parameters": "2026.10.01-5",
    "public_annex_i": "rfb-41766-sandbox-1",
    "federal_obligations": "2026-sandbox-3",
    "federal_banking_calendar": "2026-national-febraban-1",
    "rtc_rates": "2026.09.25-1",
    "rtc_codes": "2026.10.16-96-draft1",
    "rtc_transition": "2026.10.15-91-draft1"
  },
  "facts": {
    "service.canonical_id": "SOFTWARE_DEVELOPMENT",
    "provider.municipality_ibge": "3550308",
    "customer.municipality_ibge": "3509502",
    "customer.person_type": "PJ",
    "operation.service_origin": "DOMESTIC",
    "provider.tax_regime": "LUCRO_REAL",
    "provider.person_type": "PRIVATE_LEGAL_ENTITY",
    "operation.amount": "5179.50",
    "federal.evaluate_withholdings": false,
    "rtc.evaluate": true,
    "rtc.operation_date": "2026-09-25",
    "rtc.operation_kind": "DIGITAL",
    "rtc.buyer_relation": "B2B",
    "rtc.delivery_mode": "DIGITAL",
    "rtc.consideration": "ONEROUS",
    "rtc.market": "EXPORT",
    "rtc.supplier_regime": "REGULAR",
    "rtc.supplier_id": "11111111000191",
    "rtc.supplier_country": "BR",
    "rtc.acquirer_id": "22222222000191",
    "rtc.recipient_id": "22222222000191",
    "rtc.acquirer_country": "US",
    "rtc.recipient_country": "US",
    "rtc.destination_basis": "RECIPIENT_DOMICILE",
    "rtc.destination_state": "SP",
    "rtc.destination_municipality_ibge": "3509502",
    "rtc.destination_evidence_id": "contract-establishment-1",
    "rtc.document_id": "dps-1",
    "rtc.gross_amount": "1000.00",
    "rtc.gross_currency": "USD",
    "rtc.legacy_tax_inclusion": "EXCLUDED",
    "rtc.legacy_tax_evidence_id": "net-price-contract-line-1",
    "rtc.base_adjustments": [],
    "rtc.tax_treatment": "STANDARD",
    "rtc.collection_method": "SUPPLIER",
    "rtc.accessory_obligations_fulfilled": true,
    "rtc.credit_context": "OUTPUT",
    "rtc.foreign_consumption_proven": true,
    "rtc.export_evidence_id": "foreign-consumption-contract-1",
    "rtc.export_share_percent": "40",
    "rtc.domestic_consumption_evidence_id": "brazil-usage-report-1",
    "rtc.export_allocation_method": "METERED_USAGE",
    "rtc.export_allocation_evidence_id": "usage-meter-sep-2026",
    "rtc.export_domestic_recipient_id": "33333333000191",
    "rtc.export_domestic_recipient_country": "BR",
    "rtc.export_domestic_document_id": "dps-domestic-1",
    "rtc.acquirer_foreign_nif": "FOREIGN-ACQUIRER-NIF-73",
    "rtc.export_foreign_document_id": "foreign-invoice-73",
    "rtc.export_transaction_evidence_id": "export-contract-73",
    "rtc.operation_amount_reconciliation_id": "export-fx-reconciliation-73",
    "rtc.export_fx_source_id": "USD",
    "rtc.export_fx_proof": [
      {
        "qualified": true,
        "scope": "SYNTHETIC_COMPLETE_PARTIAL_EXPORT_FX_TRANSACTION_NOT_REMOTE_VERIFICATION",
        "evidence_id": "export-fx-reconciliation-73",
        "valid_from": "2026-09-01",
        "valid_to": "2026-09-30",
        "observed_at": "2026-10-14T11:07:00+00:00",
        "value": {
          "supplier_id": "11111111000191",
          "acquirer_foreign_nif": "FOREIGN-ACQUIRER-NIF-73",
          "domestic_recipient_id": "33333333000191",
          "document_id": "dps-1",
          "foreign_document_id": "foreign-invoice-73",
          "transaction_evidence_id": "export-contract-73",
          "tax_point_date": "2026-09-25",
          "original_amount": "1000.00",
          "original_currency": "USD",
          "converted_gross_brl": "5179.50",
          "operation_amount_brl": "5179.50",
          "quote_source_id": "USD",
          "quote_source_sha256": "d9d814bf5109538520f36f18ee8b1ea7575ab8831e650550ece7a326867756a3",
          "supplier_country": "BR",
          "acquirer_id": "22222222000191",
          "acquirer_country": "US",
          "recipient_id": "22222222000191",
          "recipient_country": "US",
          "domestic_recipient_country": "BR",
          "domestic_document_id": "dps-domestic-1",
          "foreign_share_percent": "40",
          "allocation_method": "METERED_USAGE",
          "allocation_evidence_id": "usage-meter-sep-2026",
          "domestic_consumption_evidence_id": "brazil-usage-report-1",
          "export_evidence_id": "foreign-consumption-contract-1"
        },
        "source_hash": "df85696031e55b581fbf7313f42e80ac0dd627fc560f9aaffa2236c6c69afc75"
      }
    ],
    "rtc.assess_export_iss_results": true,
    "rtc.export_operation_reference": "SYNTHETIC-EXPORT-ISS96-no-contexts"
  }
}