{
  "scenario_id": "financial-borrower-credit-loan-2026",
  "competence_date": "2026-09-30",
  "knowledge_at": "2026-10-02T18:38:19+00:00",
  "rule_bundle_id": "CONSUMPTION-PHASE4B-2026.10.02-17",
  "catalog_versions": {
    "services": "2026.09.17-1",
    "municipal_parameters": "2026.10.01-5",
    "public_annex_i": "rfb-41766-sandbox-1",
    "federal_obligations": "2026-sandbox-3",
    "federal_banking_calendar": "2026-national-febraban-1",
    "rtc_rates": "2026.09.25-1",
    "rtc_codes": "2026.10.02-17",
    "rtc_transition": "2026.10.01-2"
  },
  "facts": {
    "provider.municipality_ibge": "3550308",
    "customer.municipality_ibge": "3509502",
    "customer.person_type": "PJ",
    "operation.service_origin": "DOMESTIC",
    "provider.tax_regime": "LUCRO_REAL",
    "provider.person_type": "PRIVATE_LEGAL_ENTITY",
    "operation.amount": "1000.00",
    "rtc.evaluate": true,
    "rtc.operation_date": "2026-09-30",
    "rtc.operation_kind": "FINANCIAL",
    "rtc.buyer_relation": "B2B",
    "rtc.delivery_mode": "DIGITAL",
    "rtc.consideration": "ONEROUS",
    "rtc.market": "DOMESTIC",
    "rtc.supplier_regime": "REGULAR",
    "rtc.supplier_id": "11111111000191",
    "rtc.supplier_country": "BR",
    "rtc.acquirer_id": "22222222000191",
    "rtc.recipient_id": "22222222000191",
    "rtc.acquirer_country": "BR",
    "rtc.recipient_country": "BR",
    "rtc.destination_basis": "ACQUIRER_DOMICILE",
    "rtc.destination_state": "SP",
    "rtc.destination_municipality_ibge": "3509502",
    "rtc.destination_evidence_id": "contract-establishment-1",
    "rtc.document_id": "dps-1",
    "rtc.gross_amount": "1000.00",
    "rtc.gross_currency": "BRL",
    "rtc.legacy_tax_inclusion": "EXCLUDED",
    "rtc.legacy_tax_evidence_id": "net-price-contract-line-1",
    "rtc.base_adjustments": [],
    "rtc.tax_treatment": "STANDARD",
    "rtc.collection_method": "SUPPLIER",
    "rtc.accessory_obligations_fulfilled": false,
    "rtc.credit_context": "INPUT",
    "rtc.financial_provider": true,
    "rtc.financial_scope_proof": [
      {
        "supplier_id": "11111111000191",
        "document_id": "dps-1",
        "provider_category": "BANK",
        "supervision": "SFN_SUPERVISED",
        "supervision_effective": true,
        "supervision_registry_evidence_id": "FIXTURE.SFN.REGISTRY",
        "provider_scope_evidence_id": "FIXTURE.PROVIDER",
        "operation_scope_evidence_id": "FIXTURE.SOFTWARE.CONTRACT",
        "valid_from": "2026-01-01",
        "valid_to": "2026-12-31",
        "observed_on": "2026-10-01",
        "operation_category": "CREDIT",
        "not_art182_service": true,
        "non_financial_scope_evidence_id": "FIXTURE.NONFINANCIAL.SOFTWARE",
        "provider_authorized_for_operation": true,
        "operation_authorization_evidence_id": "FIXTURE.CREDIT.AUTHORIZATION"
      }
    ],
    "federal.evaluate_withholdings": false,
    "rtc.financial_ledger": [
      {
        "family": "CREDIT_FX_SECURITIES_ART192",
        "supplier_id": "11111111000191",
        "scope_document_id": "dps-1",
        "currency": "BRL",
        "period_start": "2026-09-01",
        "period_end": "2026-09-30",
        "observed_on": "2026-10-01",
        "ledger_complete": true,
        "financial_scope_qualified": true,
        "recognition_dates_qualified": true,
        "net_of_ibs_cbs_iss": true,
        "cooperative_art271_option": false,
        "ledger_evidence_id": "FIXTURE.LEDGER",
        "scope_evidence_id": "FIXTURE.SCOPE",
        "recognition_evidence_id": "FIXTURE.RECOGNITION",
        "tax_exclusion_evidence_id": "FIXTURE.NET",
        "entries": [
          {
            "supplier_id": "11111111000191",
            "recognized_on": "2026-09-20",
            "qualification_evidence_id": "FIXTURE.QUALIFIED",
            "id": "interest",
            "kind": "FINANCIAL_REVENUE",
            "document_id": "contract1",
            "amount": "1000.00"
          },
          {
            "supplier_id": "11111111000191",
            "recognized_on": "2026-09-20",
            "qualification_evidence_id": "FIXTURE.QUALIFIED",
            "id": "principal",
            "kind": "CREDIT_PRINCIPAL",
            "document_id": "contract1",
            "amount": "10000.00"
          },
          {
            "supplier_id": "11111111000191",
            "recognized_on": "2026-09-20",
            "qualification_evidence_id": "FIXTURE.QUALIFIED",
            "id": "funding",
            "kind": "FUNDING_EXPENSE",
            "document_id": "funding1",
            "amount": "200.00",
            "operation_authorized": true,
            "within_operational_limits": true,
            "not_administrative_expense": true,
            "authorization_evidence_id": "FIXTURE.AUTHORIZED"
          }
        ]
      }
    ],
    "rtc.acquirer_regime": "REGULAR",
    "rtc.financial_credit_proof": [
      {
        "supplier_id": "11111111000191",
        "acquirer_id": "22222222000191",
        "document_id": "dps-1",
        "route": "LOAN_INSTALMENT_ART194",
        "operation_category": "CREDIT",
        "acquirer_regime": "REGULAR",
        "not_personal_use": true,
        "acquirer_in_section_specific_regime": false,
        "cooperative_option271_member_borrower": false,
        "foreign_currency_referenced": false,
        "operation_qualification_evidence_id": "FIXTURE.QUALIFIED",
        "supplier_report_evidence_id": "FIXTURE.REPORT",
        "fiscal_document_evidence_id": "FIXTURE.DOCUMENT",
        "fiscal_document_valid": true,
        "supplier_report_bound_to_operation": true,
        "supplier_report_hash": "aaaaaaaaaaaaaaaaaaaaaaaaaaaaaaaaaaaaaaaaaaaaaaaaaaaaaaaaaaaaaaaa",
        "credit_request_ledger_evidence_id": "FIXTURE.REQUEST.LEDGER",
        "transaction_id": "instalment1",
        "request_not_already_appropriated": true,
        "observed_on": "2026-09-30",
        "payment_occurred": true,
        "paid_on": "2026-09-20",
        "payment_evidence_id": "FIXTURE.PAID",
        "instalment_paid": "1200.00",
        "contractual_principal_part": "1000.00",
        "qualified_selic_amount": "50.00",
        "contractual_amortization_evidence_id": "FIXTURE.AMORTIZATION",
        "benchmark_kind": "SELIC_OVERNIGHT_ON_PRINCIPAL",
        "benchmark_calculation_qualified": true,
        "benchmark_period_evidence_id": "FIXTURE.REFERENCE.PERIOD",
        "benchmark_source_hash": "bbbbbbbbbbbbbbbbbbbbbbbbbbbbbbbbbbbbbbbbbbbbbbbbbbbbbbbbbbbbbbbb",
        "components": {
          "IBS": {
            "tax": "IBS",
            "supplier_report_component_id": "report-IBS",
            "reported_credit_limit": "5.00",
            "requested_credit": "0.15",
            "extinction_qualification": "PROVEN_EXTINCTION",
            "extinction_evidence_id": "FIXTURE.EXTINCTION",
            "supplier_tax_actually_paid_for_fee": "0.15",
            "supplier_tax_paid_on": "2026-09-25",
            "supplier_payment_evidence_id": "FIXTURE.SUPPLIER.PAYMENT"
          },
          "CBS": {
            "tax": "CBS",
            "supplier_report_component_id": "report-CBS",
            "reported_credit_limit": "5.00",
            "requested_credit": "1.35",
            "extinction_qualification": "PROVEN_EXTINCTION",
            "extinction_evidence_id": "FIXTURE.EXTINCTION",
            "supplier_tax_actually_paid_for_fee": "1.35",
            "supplier_tax_paid_on": "2026-09-25",
            "supplier_payment_evidence_id": "FIXTURE.SUPPLIER.PAYMENT"
          }
        }
      }
    ]
  }
}
