{
  "scenario_id": "import-digital-partial-unproven-2026",
  "competence_date": "2026-09-25",
  "knowledge_at": "2026-09-28T11:00:00-03:00",
  "rule_bundle_id": "CONSUMPTION-PHASE4B-2026.09.28-1",
  "catalog_versions": {
    "services": "2026.09.17-1",
    "municipal_parameters": "2026.09.16-1",
    "public_annex_i": "rfb-41766-sandbox-1",
    "federal_obligations": "2026-sandbox-3",
    "federal_banking_calendar": "2026-national-febraban-1",
    "rtc_rates": "2026.09.25-1",
    "rtc_codes": "2026.09.25-1",
    "rtc_transition": "2026.09.25-1"
  },
  "facts": {
    "service.canonical_id": "SOFTWARE_DEVELOPMENT",
    "provider.municipality_ibge": "3550308",
    "customer.municipality_ibge": "3509502",
    "customer.person_type": "PJ",
    "provider.person_type": "PRIVATE_LEGAL_ENTITY",
    "operation.amount": "1000.00",
    "federal.evaluate_withholdings": false,
    "rtc.evaluate": true,
    "rtc.operation_date": "2026-09-25",
    "rtc.operation_kind": "DIGITAL",
    "rtc.buyer_relation": "B2B",
    "rtc.delivery_mode": "DIGITAL",
    "rtc.consideration": "ONEROUS",
    "rtc.market": "IMPORT",
    "rtc.supplier_regime": "FOREIGN",
    "rtc.supplier_id": "11111111000191",
    "rtc.supplier_country": "US",
    "rtc.acquirer_id": "22222222000191",
    "rtc.recipient_id": "22222222000191",
    "rtc.acquirer_country": "BR",
    "rtc.recipient_country": "BR",
    "rtc.destination_basis": "ACQUIRER_DOMICILE",
    "rtc.destination_state": "SP",
    "rtc.destination_municipality_ibge": "3509502",
    "rtc.destination_evidence_id": "contract-establishment-1",
    "rtc.document_id": "dps-1",
    "rtc.gross_amount": "1000.00",
    "rtc.gross_currency": "BRL",
    "rtc.legacy_tax_inclusion": "EXCLUDED",
    "rtc.legacy_tax_evidence_id": "net-price-contract-line-1",
    "rtc.base_adjustments": [],
    "rtc.tax_treatment": "STANDARD",
    "rtc.collection_method": "ACQUIRER",
    "rtc.accessory_obligations_fulfilled": true,
    "rtc.credit_context": "OUTPUT",
    "rtc.importer_id": "22222222000191",
    "rtc.import_document_id": "foreign-invoice-1",
    "rtc.supplier_foreign_nif": "US-FOREIGN-123",
    "rtc.import_transaction_evidence_id": "payment-record-1",
    "rtc.import_fx_contract_applicable": false,
    "rtc.domestic_consumption_evidence_id": "brazil-use-contract-1",
    "rtc.import_brazil_share_percent": "25",
    "rtc.collection_legal_basis": "LC214-ART64-V"
  }
}
