{
    "scenario_id": "DATED108-fx-refusal-proof-missing",
    "competence_date": "2026-09-25",
    "knowledge_at": "2026-10-19T16:58:22.398209+00:00",
    "rule_bundle_id": "CONSUMPTION-PHASE4B-2026.10.19-108-draft3",
    "catalog_versions": {
        "services": "2026.09.17-1",
        "municipal_parameters": "2026.10.01-5",
        "public_annex_i": "rfb-41766-sandbox-1",
        "federal_obligations": "2026-sandbox-3",
        "federal_banking_calendar": "2026-national-febraban-1",
        "rtc_rates": "2026.09.25-1",
        "rtc_codes": "2026.10.19-108-draft3",
        "rtc_transition": "2026.10.15-91-draft1"
    },
    "facts": {
        "service.canonical_id": "SOFTWARE_DEVELOPMENT",
        "provider.municipality_ibge": "3550308",
        "customer.municipality_ibge": "3509502",
        "customer.person_type": "PJ",
        "operation.service_origin": "DOMESTIC",
        "provider.tax_regime": "LUCRO_REAL",
        "provider.person_type": "PRIVATE_LEGAL_ENTITY",
        "operation.amount": "5179.50",
        "federal.evaluate_withholdings": false,
        "rtc.evaluate": true,
        "rtc.operation_date": "2026-09-25",
        "rtc.operation_kind": "DIGITAL",
        "rtc.buyer_relation": "B2B",
        "rtc.delivery_mode": "DIGITAL",
        "rtc.consideration": "ONEROUS",
        "rtc.market": "EXPORT",
        "rtc.supplier_regime": "REGULAR",
        "rtc.supplier_id": "11111111000191",
        "rtc.supplier_country": "BR",
        "rtc.acquirer_id": "22222222000191",
        "rtc.recipient_id": "22222222000191",
        "rtc.acquirer_country": "US",
        "rtc.recipient_country": "US",
        "rtc.destination_basis": "RECIPIENT_DOMICILE",
        "rtc.destination_state": "SP",
        "rtc.destination_municipality_ibge": "3509502",
        "rtc.destination_evidence_id": "contract-establishment-1",
        "rtc.document_id": "dps-1",
        "rtc.gross_amount": "1000.00",
        "rtc.gross_currency": "USD",
        "rtc.legacy_tax_inclusion": "EXCLUDED",
        "rtc.legacy_tax_evidence_id": "net-price-contract-line-1",
        "rtc.base_adjustments": [],
        "rtc.tax_treatment": "STANDARD",
        "rtc.collection_method": "SUPPLIER",
        "rtc.accessory_obligations_fulfilled": true,
        "rtc.credit_context": "OUTPUT",
        "rtc.foreign_consumption_proven": true,
        "rtc.export_evidence_id": "foreign-consumption-contract-1",
        "rtc.export_share_percent": "40",
        "rtc.domestic_consumption_evidence_id": "brazil-usage-report-1",
        "rtc.export_allocation_method": "METERED_USAGE",
        "rtc.export_allocation_evidence_id": "usage-meter-sep-2026",
        "rtc.export_domestic_recipient_id": "33333333000191",
        "rtc.export_domestic_recipient_country": "BR",
        "rtc.export_domestic_document_id": "dps-domestic-1",
        "rtc.acquirer_foreign_nif": "FOREIGN-ACQUIRER-NIF-73",
        "rtc.export_foreign_document_id": "foreign-invoice-73",
        "rtc.export_transaction_evidence_id": "export-contract-73",
        "rtc.operation_amount_reconciliation_id": "export-fx-reconciliation-73",
        "rtc.export_fx_source_id": "USD",
        "rtc.export_fx_proof": [],
        "rtc.assess_export_iss_results": false,
        "rtc.assess_export_sp_results": false,
        "rtc.assess_export_dps_identity": false,
        "rtc.assess_export_dated_documents": true,
        "provider.iss_regime": "GENERAL_AD_VALOREM",
        "provider.iss_regime_proof_records": [
            {
                "contract": "ISS-PARTIAL-EXPORT-MATERIAL-EVIDENCE-2026.10.19-105",
                "kind": "ISS_SUPPLIER_REGIME_MATERIAL_EVIDENCE",
                "evidence_id": "REGIME-fx-refusal-proof-missing",
                "valid_from": "2026-01-01",
                "valid_to": "2032-12-31",
                "observed_at": "2026-10-19T16:58:22.398209+00:00",
                "revoked_at": null,
                "superseded_at": null,
                "value": {
                    "supplier_id": "11111111000191",
                    "supplier_municipality": "3550308",
                    "service_kind": "SOFTWARE_SERVICE",
                    "regime": "GENERAL_AD_VALOREM",
                    "special_regime": false,
                    "supplier_immunity": false,
                    "supplier_flat_tax": false,
                    "simples_option": false
                },
                "origin": {
                    "reference": "synthetic:\/\/dated108\/REGIME-fx-refusal-proof-missing",
                    "media_type": "application\/json",
                    "content": "{\"contract\":\"ISS-PARTIAL-EXPORT-MATERIAL-EVIDENCE-2026.10.19-105\",\"evidence_id\":\"REGIME-fx-refusal-proof-missing\",\"kind\":\"ISS_SUPPLIER_REGIME_MATERIAL_EVIDENCE\",\"observed_at\":\"2026-10-19T16:58:22.398209+00:00\",\"revoked_at\":null,\"superseded_at\":null,\"valid_from\":\"2026-01-01\",\"valid_to\":\"2032-12-31\",\"value\":{\"regime\":\"GENERAL_AD_VALOREM\",\"service_kind\":\"SOFTWARE_SERVICE\",\"simples_option\":false,\"special_regime\":false,\"supplier_flat_tax\":false,\"supplier_id\":\"11111111000191\",\"supplier_immunity\":false,\"supplier_municipality\":\"3550308\"}}",
                    "content_sha256": "60e46ad101ce12c6821b65d2722bc7cc360365e19829608c7b97a18540ccafe4"
                },
                "source_hash": "993848318e086c0be2eace2373eb8080391cf6d58f730413176ae6c4d8dc2dbd"
            }
        ],
        "rtc.export_iss_material_records": [],
        "rtc.export_iss_dated_result_records": [],
        "rtc.export_dated_dps_identity_records": []
    }
}