{
  "scenario_id": "integrated-financial-credit-general-bank-software-2026",
  "competence_date": "2026-10-01",
  "knowledge_at": "2026-10-06T13:48:43+00:00",
  "rule_bundle_id": "CONSUMPTION-PHASE4B-2026.10.06-22",
  "catalog_versions": {
    "services": "2026.09.17-1",
    "municipal_parameters": "2026.10.01-5",
    "public_annex_i": "rfb-41766-sandbox-1",
    "federal_obligations": "2026-sandbox-3",
    "federal_banking_calendar": "2026-national-febraban-1",
    "rtc_rates": "2026.09.25-1",
    "rtc_codes": "2026.10.06-22",
    "rtc_transition": "2026.10.01-2"
  },
  "facts": {
    "service.canonical_id": "SOFTWARE_DEVELOPMENT",
    "provider.municipality_ibge": "3550308",
    "customer.municipality_ibge": "3509502",
    "customer.person_type": "PJ",
    "operation.service_origin": "DOMESTIC",
    "provider.tax_regime": "LUCRO_REAL",
    "provider.person_type": "PRIVATE_LEGAL_ENTITY",
    "operation.amount": "1000.00",
    "federal.evaluate_withholdings": true,
    "rtc.evaluate": true,
    "rtc.operation_date": "2026-10-01",
    "rtc.operation_kind": "DIGITAL",
    "rtc.buyer_relation": "B2B",
    "rtc.delivery_mode": "DIGITAL",
    "rtc.consideration": "ONEROUS",
    "rtc.market": "DOMESTIC",
    "rtc.supplier_regime": "REGULAR",
    "rtc.supplier_id": "11111111000191",
    "rtc.supplier_country": "BR",
    "rtc.acquirer_id": "22222222000191",
    "rtc.recipient_id": "22222222000191",
    "rtc.acquirer_country": "BR",
    "rtc.recipient_country": "BR",
    "rtc.destination_basis": "ACQUIRER_DOMICILE",
    "rtc.destination_state": "SP",
    "rtc.destination_municipality_ibge": "3509502",
    "rtc.destination_evidence_id": "contract-establishment-1",
    "rtc.document_id": "dps-1",
    "rtc.gross_amount": "1000.00",
    "rtc.gross_currency": "BRL",
    "rtc.legacy_tax_inclusion": "EXCLUDED",
    "rtc.legacy_tax_evidence_id": "net-price-contract-line-1",
    "rtc.base_adjustments": [],
    "rtc.tax_treatment": "STANDARD",
    "rtc.collection_method": "SUPPLIER",
    "rtc.accessory_obligations_fulfilled": true,
    "rtc.credit_context": "OUTPUT",
    "payment.occurred": true,
    "payment.date": "2026-10-01",
    "payment.gross_amount": "1000.00",
    "payer.person_type": "PRIVATE_LEGAL_ENTITY",
    "payer.tax_regime": "LUCRO_REAL",
    "payer.head_office_tax_id": "22222222000191",
    "federal.service_category": "PROFESSIONAL_SERVICE",
    "federal.pis_status": "APPLICABLE",
    "federal.cofins_status": "APPLICABLE",
    "federal.csll_status": "APPLICABLE",
    "federal.income_nature_code": "17001",
    "inss.service_group": "OUTSIDE_EXHAUSTIVE_LIST",
    "inss.service_category": "SOFTWARE_DEVELOPMENT",
    "inss.execution_mode": "CONTRACT_FOR_RESULT",
    "invoice.issue_date": "2026-10-01",
    "invoice.gross_amount": "1000.00",
    "rtc.financial_provider": true,
    "rtc.financial_scope_proof": [
      {
        "supplier_id": "11111111000191",
        "document_id": "dps-1",
        "provider_category": "BANK",
        "supervision": "SFN_SUPERVISED",
        "supervision_effective": true,
        "supervision_registry_evidence_id": "FIXTURE.SFN.REGISTRY",
        "provider_scope_evidence_id": "FIXTURE.PROVIDER",
        "operation_scope_evidence_id": "FIXTURE.SOFTWARE.CONTRACT",
        "valid_from": "2026-01-01",
        "valid_to": "2026-12-31",
        "observed_on": "2026-10-01",
        "operation_category": "OTHER_NON_FINANCIAL_SERVICE",
        "not_art182_service": true,
        "non_financial_scope_evidence_id": "FIXTURE.NONFINANCIAL.SOFTWARE"
      }
    ]
  }
}
