{
  "scenario_id": "integrated-monthly-assessment-future-evidence-2026",
  "competence_date": "2026-10-01",
  "knowledge_at": "2026-10-02T13:35:16+00:00",
  "rule_bundle_id": "CONSUMPTION-PHASE4B-2026.10.02-7",
  "catalog_versions": {
    "services": "2026.09.17-1",
    "municipal_parameters": "2026.10.01-5",
    "public_annex_i": "rfb-41766-sandbox-1",
    "federal_obligations": "2026-sandbox-3",
    "federal_banking_calendar": "2026-national-febraban-1",
    "rtc_rates": "2026.09.25-1",
    "rtc_codes": "2026.10.02-7",
    "rtc_transition": "2026.10.01-2"
  },
  "facts": {
    "service.canonical_id": "CTRIBNAC_040101",
    "provider.municipality_ibge": "3550308",
    "customer.municipality_ibge": "3509502",
    "customer.person_type": "PJ",
    "operation.service_origin": "DOMESTIC",
    "provider.tax_regime": "LUCRO_REAL",
    "provider.person_type": "PRIVATE_LEGAL_ENTITY",
    "operation.amount": "1000.00",
    "federal.evaluate_withholdings": false,
    "rtc.evaluate": true,
    "rtc.operation_date": "2026-10-01",
    "rtc.operation_kind": "SERVICE",
    "rtc.buyer_relation": "B2B",
    "rtc.delivery_mode": "PRESENTIAL",
    "rtc.consideration": "ONEROUS",
    "rtc.market": "DOMESTIC",
    "rtc.supplier_regime": "REGULAR",
    "rtc.supplier_id": "11111111000191",
    "rtc.supplier_country": "BR",
    "rtc.acquirer_id": "22222222000191",
    "rtc.recipient_id": "12345678901",
    "rtc.acquirer_country": "BR",
    "rtc.recipient_country": "BR",
    "rtc.destination_basis": "PERSON_PRESENCE",
    "rtc.destination_state": "SP",
    "rtc.destination_municipality_ibge": "3550308",
    "rtc.destination_evidence_id": "contract-establishment-1",
    "rtc.document_id": "dps-1",
    "rtc.gross_amount": "1000.00",
    "rtc.gross_currency": "BRL",
    "rtc.legacy_tax_inclusion": "EXCLUDED",
    "rtc.legacy_tax_evidence_id": "net-price-contract-line-1",
    "rtc.base_adjustments": [],
    "rtc.tax_treatment": "REDUCED_60",
    "rtc.collection_method": "SUPPLIER",
    "rtc.accessory_obligations_fulfilled": true,
    "rtc.credit_context": "OUTPUT",
    "rtc.service_on_person_or_enjoyed_in_person": true,
    "rtc.service_presence_evidence_id": "FIXTURE.PERSONAL.PERFORMANCE",
    "rtc.performance_municipality_ibge": "3550308",
    "rtc.performance_state": "SP",
    "rtc.supplier_establishment_state": "SP",
    "rtc.presence_at_supplier_establishment": true,
    "rtc.annex_service_description_confirmed": true,
    "rtc.annex_service_only_consideration": true,
    "rtc.annex_service_scope_evidence_id": "FIXTURE.ANNEX.CONSIDERATION",
    "rtc.service_nbs_evidence_id": "FIXTURE.NBS.CLASSIFICATION",
    "rtc.treatment_evidence_id": "FIXTURE.ANNEX.ELIGIBILITY",
    "service.ctribnac_code": "040101",
    "rtc.annex_service_category": "HEALTH",
    "rtc.annex_service_item": "7",
    "rtc.service_nbs_code": "1.2301.21.00",
    "rtc.treatment_rule_id": "RTC.TREATMENT.LC214.ART130-1",
    "rtc.health_medical_audit_glosa_amount": "0.00",
    "rtc.assess_monthly_period": true,
    "rtc.monthly_assessment": [
      {
        "month": "2026-09",
        "supplier_id": "11111111000191",
        "currency": "BRL",
        "establishments": [
          "11111111000191",
          "11111111000272"
        ],
        "central_establishment_id": "11111111000191",
        "all_establishments_included": true,
        "all_regimes_included": true,
        "ledger_complete": true,
        "credits_net_of_annulments": true,
        "prior_debts_complete": true,
        "ledger_evidence_id": "FIXTURE.COMPLETE.ledger_evidence_id",
        "establishment_registry_evidence_id": "FIXTURE.COMPLETE.establishment_registry_evidence_id",
        "credit_qualification_evidence_id": "FIXTURE.COMPLETE.credit_qualification_evidence_id",
        "prior_debts_evidence_id": "FIXTURE.COMPLETE.prior_debts_evidence_id",
        "debits": [
          {
            "id": "debit-ibs",
            "tax": "IBS",
            "amount": "100.00",
            "date": "2026-09-10",
            "observed_on": "2026-10-01",
            "establishment_id": "11111111000191",
            "qualification_status": "RESOLVED",
            "qualification_evidence_id": "FIXTURE.QUALIFIED.debit-ibs",
            "qualification_hash": "e0f71cee1547bd336de5e3b5f70184287fd7cc3a4c7735946a9ead4aed895f62",
            "document_id": "output1",
            "due_status": "DUE"
          },
          {
            "id": "debit-cbs",
            "tax": "CBS",
            "amount": "90.00",
            "date": "2026-09-10",
            "observed_on": "2026-10-01",
            "establishment_id": "11111111000191",
            "qualification_status": "RESOLVED",
            "qualification_evidence_id": "FIXTURE.QUALIFIED.debit-cbs",
            "qualification_hash": "1733ef690df16572031a15901c6746bfa67bb9097c970c446a3cb754cd33a2a6",
            "document_id": "output1",
            "due_status": "DUE"
          },
          {
            "id": "branch-ibs",
            "tax": "IBS",
            "amount": "20.00",
            "date": "2026-09-10",
            "observed_on": "2026-10-01",
            "establishment_id": "11111111000272",
            "qualification_status": "RESOLVED",
            "qualification_evidence_id": "FIXTURE.QUALIFIED.branch-ibs",
            "qualification_hash": "c16a7743c20e7649e905e65ea3a6d539ea3c3aa629ec3e1712b79866b3940cce",
            "document_id": "output2",
            "due_status": "DUE"
          }
        ],
        "credits": [
          {
            "id": "credit-ibs",
            "tax": "IBS",
            "amount": "30.00",
            "date": "2026-09-10",
            "observed_on": "2026-10-03",
            "establishment_id": "11111111000191",
            "qualification_status": "RESOLVED",
            "qualification_evidence_id": "FIXTURE.QUALIFIED.credit-ibs",
            "qualification_hash": "f8a4c2fdec84f3f8782ba7869cf3fe24d73a3564a1aec9bfde93830778ecfdd1",
            "document_id": "input1",
            "credit_kind": "ORDINARY",
            "appropriation_date": "2026-09-10",
            "appropriated": true,
            "appropriation_evidence_id": "FIXTURE.APPROPRIATED",
            "extinction_evidence_id": "FIXTURE.EXTINCT.INPUT"
          },
          {
            "id": "credit-cbs",
            "tax": "CBS",
            "amount": "180.00",
            "date": "2026-09-10",
            "observed_on": "2026-10-01",
            "establishment_id": "11111111000191",
            "qualification_status": "RESOLVED",
            "qualification_evidence_id": "FIXTURE.QUALIFIED.credit-cbs",
            "qualification_hash": "8ee05821eaab2e65e8aeb064d7f0906523a12dee3f693213dbb6c444888229d0",
            "document_id": "input1",
            "credit_kind": "ORDINARY",
            "appropriation_date": "2026-09-10",
            "appropriated": true,
            "appropriation_evidence_id": "FIXTURE.APPROPRIATED",
            "extinction_evidence_id": "FIXTURE.EXTINCT.INPUT"
          }
        ],
        "carryforward": [
          {
            "id": "prior-credit-ibs",
            "tax": "IBS",
            "amount": "40.00",
            "date": "2026-08-31",
            "observed_on": "2026-10-01",
            "establishment_id": "11111111000191",
            "qualification_status": "RESOLVED",
            "qualification_evidence_id": "FIXTURE.QUALIFIED.prior-credit-ibs",
            "qualification_hash": "bb7181458b215fb4420bf48cc5344be0408d2de3237022f7c882ba0a8dccabb5",
            "document_id": "prior-input1",
            "credit_kind": "ORDINARY",
            "appropriation_date": "2026-08-15",
            "appropriation_evidence_id": "FIXTURE.PRIOR.APPROPRIATED",
            "extinction_evidence_id": "FIXTURE.PRIOR.EXTINCT",
            "used_for_compensation": "5.00",
            "refunded": "10.00",
            "reserved_for_refund": "5.00"
          }
        ],
        "prior_debts": [
          {
            "id": "prior-debt-ibs",
            "tax": "IBS",
            "amount": "10.00",
            "date": "2026-08-31",
            "observed_on": "2026-10-01",
            "establishment_id": "11111111000191",
            "qualification_status": "RESOLVED",
            "qualification_evidence_id": "FIXTURE.QUALIFIED.prior-debt-ibs",
            "qualification_hash": "f647aecf25ff07e7a97471ba8f2bc9afd03e8c42a29de81825fc92b120a26255",
            "due_date": "2026-09-15",
            "overdue_unextinguished_not_enrolled": true,
            "legal_additions_evidence_id": "FIXTURE.PRIOR.DEBT.INCLUDING.ADDITIONS"
          }
        ],
        "adjustments": [],
        "extinctions": [
          {
            "id": "extinct-ibs",
            "tax": "IBS",
            "amount": "15.00",
            "date": "2026-09-20",
            "observed_on": "2026-10-01",
            "establishment_id": "11111111000191",
            "qualification_status": "RESOLVED",
            "qualification_evidence_id": "FIXTURE.QUALIFIED.extinct-ibs",
            "qualification_hash": "896ed75f28729c10fbc4fbd0c195ad59636fbf1e4760aa384ca38c1bd0948f0a",
            "method": "ACQUIRER_PAYMENT",
            "debit_id": "debit-ibs",
            "extinction_evidence_id": "FIXTURE.EXTINCT.OUTPUT"
          }
        ]
      }
    ]
  }
}
