{
  "scenario_id": "SYNTHETIC-FX70-ORIGIN-usd-direct",
  "competence_date": "2026-09-25",
  "knowledge_at": "2026-10-14T11:06:58+00:00",
  "rule_bundle_id": "CONSUMPTION-PHASE4B-2026.10.14-70-draft1",
  "catalog_versions": {
    "services": "2026.09.17-1",
    "municipal_parameters": "2026.10.01-5",
    "public_annex_i": "rfb-41766-sandbox-1",
    "federal_obligations": "2026-sandbox-3",
    "federal_banking_calendar": "2026-national-febraban-1",
    "rtc_rates": "2026.09.25-1",
    "rtc_codes": "2026.10.14-70-draft1",
    "rtc_transition": "2026.10.01-2"
  },
  "facts": {
    "service.canonical_id": "SOFTWARE_DEVELOPMENT",
    "provider.municipality_ibge": "3550308",
    "customer.municipality_ibge": "3509502",
    "customer.person_type": "PJ",
    "provider.person_type": "PRIVATE_LEGAL_ENTITY",
    "operation.amount": "5179.50",
    "federal.evaluate_withholdings": false,
    "rtc.evaluate": true,
    "rtc.operation_date": "2026-09-25",
    "rtc.operation_kind": "DIGITAL",
    "rtc.buyer_relation": "B2B",
    "rtc.delivery_mode": "DIGITAL",
    "rtc.consideration": "ONEROUS",
    "rtc.market": "IMPORT",
    "rtc.supplier_regime": "FOREIGN",
    "rtc.supplier_id": "11111111000191",
    "rtc.supplier_country": "US",
    "rtc.acquirer_id": "22222222000191",
    "rtc.recipient_id": "22222222000191",
    "rtc.acquirer_country": "BR",
    "rtc.recipient_country": "BR",
    "rtc.destination_basis": "ACQUIRER_DOMICILE",
    "rtc.destination_state": "SP",
    "rtc.destination_municipality_ibge": "3509502",
    "rtc.destination_evidence_id": "contract-establishment-1",
    "rtc.document_id": "dps-1",
    "rtc.gross_amount": "1000.00",
    "rtc.gross_currency": "USD",
    "rtc.legacy_tax_inclusion": "EXCLUDED",
    "rtc.legacy_tax_evidence_id": "net-price-contract-line-1",
    "rtc.base_adjustments": [],
    "rtc.tax_treatment": "STANDARD",
    "rtc.collection_method": "ACQUIRER",
    "rtc.accessory_obligations_fulfilled": true,
    "rtc.credit_context": "OUTPUT",
    "rtc.importer_id": "22222222000191",
    "rtc.import_document_id": "foreign-invoice-1",
    "rtc.supplier_foreign_nif": "US-FOREIGN-123",
    "rtc.import_transaction_evidence_id": "payment-record-1",
    "rtc.import_fx_contract_applicable": false,
    "rtc.domestic_consumption_evidence_id": "brazil-use-contract-1",
    "rtc.import_brazil_share_percent": "100",
    "rtc.collection_legal_basis": "LC214-ART64-V",
    "rtc.import_fx_source_id": "USD",
    "rtc.operation_amount_reconciliation_id": "SYNTHETIC-FX68-usd-direct",
    "rtc.import_fx_proof": [
      {
        "qualified": true,
        "scope": "SYNTHETIC_COMPLETE_IMPORT_FX_TRANSACTION_NOT_REMOTE_VERIFICATION",
        "evidence_id": "SYNTHETIC-FX68-usd-direct",
        "observed_at": "2026-10-14T10:22:58+00:00",
        "valid_from": "2026-09-01",
        "valid_to": "2026-09-30",
        "value": {
          "supplier_id": "11111111000191",
          "supplier_foreign_nif": "US-FOREIGN-123",
          "importer_id": "22222222000191",
          "document_id": "dps-1",
          "foreign_document_id": "foreign-invoice-1",
          "transaction_evidence_id": "payment-record-1",
          "tax_point_date": "2026-09-25",
          "original_amount": "1000.00",
          "original_currency": "USD",
          "converted_gross_brl": "5179.50",
          "operation_amount_brl": "5179.50",
          "quote_source_id": "USD",
          "quote_source_sha256": "d9d814bf5109538520f36f18ee8b1ea7575ab8831e650550ece7a326867756a3"
        },
        "source_hash": "53a0ea760d4782a5467d10b18a098588bf25e02c21b4367d6d5fe4b773918603"
      }
    ]
  }
}