{
  "scenario_id": "health-unpaid-glosa-2026",
  "competence_date": "2026-10-01",
  "knowledge_at": "2026-10-01T18:14:59+00:00",
  "rule_bundle_id": "CONSUMPTION-PHASE4B-2026.10.01-6",
  "catalog_versions": {
    "services": "2026.09.17-1",
    "municipal_parameters": "2026.10.01-5",
    "public_annex_i": "rfb-41766-sandbox-1",
    "federal_obligations": "2026-sandbox-3",
    "federal_banking_calendar": "2026-national-febraban-1",
    "rtc_rates": "2026.09.25-1",
    "rtc_codes": "2026.10.01-6",
    "rtc_transition": "2026.10.01-2"
  },
  "facts": {
    "service.canonical_id": "CTRIBNAC_040101",
    "provider.municipality_ibge": "3550308",
    "customer.municipality_ibge": "3509502",
    "customer.person_type": "PJ",
    "operation.service_origin": "DOMESTIC",
    "provider.tax_regime": "LUCRO_REAL",
    "provider.person_type": "PRIVATE_LEGAL_ENTITY",
    "operation.amount": "1000.00",
    "federal.evaluate_withholdings": false,
    "rtc.evaluate": true,
    "rtc.operation_date": "2026-10-01",
    "rtc.operation_kind": "SERVICE",
    "rtc.buyer_relation": "B2B",
    "rtc.delivery_mode": "PRESENTIAL",
    "rtc.consideration": "ONEROUS",
    "rtc.market": "DOMESTIC",
    "rtc.supplier_regime": "REGULAR",
    "rtc.supplier_id": "11111111000191",
    "rtc.supplier_country": "BR",
    "rtc.acquirer_id": "22222222000191",
    "rtc.recipient_id": "12345678901",
    "rtc.acquirer_country": "BR",
    "rtc.recipient_country": "BR",
    "rtc.destination_basis": "PERSON_PRESENCE",
    "rtc.destination_state": "SP",
    "rtc.destination_municipality_ibge": "3550308",
    "rtc.destination_evidence_id": "contract-establishment-1",
    "rtc.document_id": "dps-1",
    "rtc.gross_amount": "1000.00",
    "rtc.gross_currency": "BRL",
    "rtc.legacy_tax_inclusion": "EXCLUDED",
    "rtc.legacy_tax_evidence_id": "net-price-contract-line-1",
    "rtc.base_adjustments": [],
    "rtc.tax_treatment": "REDUCED_60",
    "rtc.collection_method": "SUPPLIER",
    "rtc.accessory_obligations_fulfilled": true,
    "rtc.credit_context": "OUTPUT",
    "rtc.service_on_person_or_enjoyed_in_person": true,
    "rtc.service_presence_evidence_id": "FIXTURE.PERSONAL.PERFORMANCE",
    "rtc.performance_municipality_ibge": "3550308",
    "rtc.performance_state": "SP",
    "rtc.supplier_establishment_state": "SP",
    "rtc.presence_at_supplier_establishment": true,
    "rtc.annex_service_description_confirmed": true,
    "rtc.annex_service_only_consideration": true,
    "rtc.annex_service_scope_evidence_id": "FIXTURE.ANNEX.CONSIDERATION",
    "rtc.service_nbs_evidence_id": "FIXTURE.NBS.CLASSIFICATION",
    "rtc.treatment_evidence_id": "FIXTURE.ANNEX.ELIGIBILITY",
    "service.ctribnac_code": "040101",
    "rtc.annex_service_category": "HEALTH",
    "rtc.annex_service_item": "7",
    "rtc.service_nbs_code": "1.2301.21.00",
    "rtc.treatment_rule_id": "RTC.TREATMENT.LC214.ART130-1",
    "rtc.health_medical_audit_glosa_amount": "100.00",
    "rtc.health_medical_audit_glosa_evidence_id": "FIXTURE.MEDICAL.AUDIT",
    "rtc.health_glosa_paid": false,
    "rtc.health_glosa_nonpayment_evidence_id": "FIXTURE.MEDICAL.NONPAYMENT"
  }
}
